[
  {
    "$schema": "ultra-test-report-v1",
    "change_id": "change-example",
    "task_ids": ["task-example"],
    "git_commit": "0123456789abcdef0123456789abcdef01234567",
    "worktree_digest": "0123456789abcdef0123456789abcdef0123456789abcdef0123456789abcdef",
    "context_digest": "abcdef0123456789abcdef0123456789abcdef0123456789abcdef0123456789",
    "acceptance": [
      {
        "id": "acceptance-1",
        "status": "pass",
        "evidence": "The public behavior was observed at the declared seam."
      }
    ],
    "commands": [
      {
        "command": "npm test",
        "status": "pass",
        "exit_code": 0,
        "evidence": "The command exited with zero failures."
      }
    ],
    "public_seams": [
      {
        "seam": "CLI status command",
        "status": "pass",
        "evidence": "The command returned the expected authoritative status."
      }
    ],
    "failures": [],
    "recovery": [
      {
        "scenario": "Missing state database",
        "status": "pass",
        "evidence": "The command returned STATE_DB_MISSING without mutation."
      }
    ],
    "verification_profile": {
      "rationale": "Acceptance, regression, integration, static analysis, build, and recovery cover the changed public and operational seams.",
      "selected_dimensions": [
        "acceptance",
        "regression",
        "integration",
        "static_analysis",
        "build",
        "recovery"
      ],
      "excluded_dimensions": [
        {
          "dimension": "performance",
          "rationale": "No material performance boundary changed."
        },
        {
          "dimension": "security",
          "rationale": "No trust boundary changed."
        }
      ]
    },
    "verification_dimensions": {
      "acceptance": { "status": "pass", "evidence": ["Acceptance mapping passed."], "rationale": "Required." },
      "regression": { "status": "pass", "evidence": ["Regression suite passed."], "rationale": "Required." },
      "integration": { "status": "pass", "evidence": ["Public consumer path passed."], "rationale": "Required." },
      "static_analysis": { "status": "pass", "evidence": ["Static checks passed."], "rationale": "Configured by the repository." },
      "build": { "status": "pass", "evidence": ["Production build passed."], "rationale": "Configured by the repository." },
      "recovery": { "status": "pass", "evidence": ["Recovery scenario passed."], "rationale": "Required." }
    },
    "regression_signal": null,
    "passed": true,
    "run_count": 1,
    "timestamp": "2026-07-22T00:00:00.000Z",
    "blocking_issues": []
  }
]
